No.     Time           Source                Destination           Protocol Length Info
     49 5.977777       1.16.1                host                  USB      35     URB_INTERRUPT in

Frame 49: 35 bytes on wire (280 bits), 35 bytes captured (280 bits) on interface wireshark_extcap2640, id 0
USB URB
    [Source: 1.16.1]
    [Destination: host]
    USBPcap pseudoheader length: 27
    IRP ID: 0xffff980edd6bda20
    IRP USBD_STATUS: USBD_STATUS_SUCCESS (0x00000000)
    URB Function: URB_FUNCTION_BULK_OR_INTERRUPT_TRANSFER (0x0009)
    IRP information: 0x01, Direction: PDO -> FDO
    URB bus id: 1
    Device address: 16
    Endpoint: 0x81, Direction: IN
    URB transfer type: URB_INTERRUPT (0x01)
    Packet Data Length: 8
    [bInterfaceClass: HID (0x03)]
HID Data: 0000390000000000

No.     Time           Source                Destination           Protocol Length Info
     53 6.129784       1.16.1                host                  USB      35     URB_INTERRUPT in

Frame 53: 35 bytes on wire (280 bits), 35 bytes captured (280 bits) on interface wireshark_extcap2640, id 0
USB URB
    [Source: 1.16.1]
    [Destination: host]
    USBPcap pseudoheader length: 27
    IRP ID: 0xffff980ed6e4ea20
    IRP USBD_STATUS: USBD_STATUS_SUCCESS (0x00000000)
    URB Function: URB_FUNCTION_BULK_OR_INTERRUPT_TRANSFER (0x0009)
    IRP information: 0x01, Direction: PDO -> FDO
    URB bus id: 1
    Device address: 16
    Endpoint: 0x81, Direction: IN
    URB transfer type: URB_INTERRUPT (0x01)
    Packet Data Length: 8
    [bInterfaceClass: HID (0x03)]
HID Data: 0000000000000000

No.     Time           Source                Destination           Protocol Length Info
     55 8.033800       1.16.1                host                  USB      35     URB_INTERRUPT in

Frame 55: 35 bytes on wire (280 bits), 35 bytes captured (280 bits) on interface wireshark_extcap2640, id 0
USB URB
    [Source: 1.16.1]
    [Destination: host]
    USBPcap pseudoheader length: 27
    IRP ID: 0xffff980edd6bda20
    IRP USBD_STATUS: USBD_STATUS_SUCCESS (0x00000000)
    URB Function: URB_FUNCTION_BULK_OR_INTERRUPT_TRANSFER (0x0009)
    IRP information: 0x01, Direction: PDO -> FDO
    URB bus id: 1
    Device address: 16
    Endpoint: 0x81, Direction: IN
    URB transfer type: URB_INTERRUPT (0x01)
    Packet Data Length: 8
    [Request in: 50]
    [Time from request: 2.055964000 seconds]
    [bInterfaceClass: HID (0x03)]
HID Data: 00000b0000000000

No.     Time           Source                Destination           Protocol Length Info
     57 8.217772       1.16.1                host                  USB      35     URB_INTERRUPT in

Frame 57: 35 bytes on wire (280 bits), 35 bytes captured (280 bits) on interface wireshark_extcap2640, id 0
USB URB
    [Source: 1.16.1]
    [Destination: host]
    USBPcap pseudoheader length: 27
    IRP ID: 0xffff980ed6e4ea20
    IRP USBD_STATUS: USBD_STATUS_SUCCESS (0x00000000)
    URB Function: URB_FUNCTION_BULK_OR_INTERRUPT_TRANSFER (0x0009)
    IRP information: 0x01, Direction: PDO -> FDO
    URB bus id: 1
    Device address: 16
    Endpoint: 0x81, Direction: IN
    URB transfer type: URB_INTERRUPT (0x01)
    Packet Data Length: 8
    [Request in: 54]
    [Time from request: 2.087902000 seconds]
    [bInterfaceClass: HID (0x03)]
HID Data: 0000000000000000

No.     Time           Source                Destination           Protocol Length Info
     59 9.073763       1.16.1                host                  USB      35     URB_INTERRUPT in

Frame 59: 35 bytes on wire (280 bits), 35 bytes captured (280 bits) on interface wireshark_extcap2640, id 0
USB URB
    [Source: 1.16.1]
    [Destination: host]
    USBPcap pseudoheader length: 27
    IRP ID: 0xffff980edd6bda20
    IRP USBD_STATUS: USBD_STATUS_SUCCESS (0x00000000)
    URB Function: URB_FUNCTION_BULK_OR_INTERRUPT_TRANSFER (0x0009)
    IRP information: 0x01, Direction: PDO -> FDO
    URB bus id: 1
    Device address: 16
    Endpoint: 0x81, Direction: IN
    URB transfer type: URB_INTERRUPT (0x01)
    Packet Data Length: 8
    [Request in: 56]
    [Time from request: 1.039860000 seconds]
    [bInterfaceClass: HID (0x03)]
HID Data: 0000170000000000

No.     Time           Source                Destination           Protocol Length Info
     61 9.225741       1.16.1                host                  USB      35     URB_INTERRUPT in

Frame 61: 35 bytes on wire (280 bits), 35 bytes captured (280 bits) on interface wireshark_extcap2640, id 0
USB URB
    [Source: 1.16.1]
    [Destination: host]
    USBPcap pseudoheader length: 27
    IRP ID: 0xffff980ed6e4ea20
    IRP USBD_STATUS: USBD_STATUS_SUCCESS (0x00000000)
    URB Function: URB_FUNCTION_BULK_OR_INTERRUPT_TRANSFER (0x0009)
    IRP information: 0x01, Direction: PDO -> FDO
    URB bus id: 1
    Device address: 16
    Endpoint: 0x81, Direction: IN
    URB transfer type: URB_INTERRUPT (0x01)
    Packet Data Length: 8
    [Request in: 58]
    [Time from request: 1.007862000 seconds]
    [bInterfaceClass: HID (0x03)]
HID Data: 0000000000000000

No.     Time           Source                Destination           Protocol Length Info
     63 9.577804       1.16.1                host                  USB      35     URB_INTERRUPT in

Frame 63: 35 bytes on wire (280 bits), 35 bytes captured (280 bits) on interface wireshark_extcap2640, id 0
USB URB
    [Source: 1.16.1]
    [Destination: host]
    USBPcap pseudoheader length: 27
    IRP ID: 0xffff980edd6bda20
    IRP USBD_STATUS: USBD_STATUS_SUCCESS (0x00000000)
    URB Function: URB_FUNCTION_BULK_OR_INTERRUPT_TRANSFER (0x0009)
    IRP information: 0x01, Direction: PDO -> FDO
    URB bus id: 1
    Device address: 16
    Endpoint: 0x81, Direction: IN
    URB transfer type: URB_INTERRUPT (0x01)
    Packet Data Length: 8
    [Request in: 60]
    [Time from request: 0.503914000 seconds]
    [bInterfaceClass: HID (0x03)]
HID Data: 0000050000000000

No.     Time           Source                Destination           Protocol Length Info
     65 9.721885       1.16.1                host                  USB      35     URB_INTERRUPT in

Frame 65: 35 bytes on wire (280 bits), 35 bytes captured (280 bits) on interface wireshark_extcap2640, id 0
USB URB
    [Source: 1.16.1]
    [Destination: host]
    USBPcap pseudoheader length: 27
    IRP ID: 0xffff980ed6e4ea20
    IRP USBD_STATUS: USBD_STATUS_SUCCESS (0x00000000)
    URB Function: URB_FUNCTION_BULK_OR_INTERRUPT_TRANSFER (0x0009)
    IRP information: 0x01, Direction: PDO -> FDO
    URB bus id: 1
    Device address: 16
    Endpoint: 0x81, Direction: IN
    URB transfer type: URB_INTERRUPT (0x01)
    Packet Data Length: 8
    [Request in: 62]
    [Time from request: 0.496104000 seconds]
    [bInterfaceClass: HID (0x03)]
HID Data: 0000000000000000

No.     Time           Source                Destination           Protocol Length Info
     67 11.233790      1.16.1                host                  USB      35     URB_INTERRUPT in

Frame 67: 35 bytes on wire (280 bits), 35 bytes captured (280 bits) on interface wireshark_extcap2640, id 0
USB URB
    [Source: 1.16.1]
    [Destination: host]
    USBPcap pseudoheader length: 27
    IRP ID: 0xffff980edd6bda20
    IRP USBD_STATUS: USBD_STATUS_SUCCESS (0x00000000)
    URB Function: URB_FUNCTION_BULK_OR_INTERRUPT_TRANSFER (0x0009)
    IRP information: 0x01, Direction: PDO -> FDO
    URB bus id: 1
    Device address: 16
    Endpoint: 0x81, Direction: IN
    URB transfer type: URB_INTERRUPT (0x01)
    Packet Data Length: 8
    [Request in: 64]
    [Time from request: 1.655890000 seconds]
    [bInterfaceClass: HID (0x03)]
HID Data: 2000000000000000

No.     Time           Source                Destination           Protocol Length Info
     69 11.561811      1.16.1                host                  USB      35     URB_INTERRUPT in

Frame 69: 35 bytes on wire (280 bits), 35 bytes captured (280 bits) on interface wireshark_extcap2640, id 0
USB URB
    [Source: 1.16.1]
    [Destination: host]
    USBPcap pseudoheader length: 27
    IRP ID: 0xffff980ed6e4ea20
    IRP USBD_STATUS: USBD_STATUS_SUCCESS (0x00000000)
    URB Function: URB_FUNCTION_BULK_OR_INTERRUPT_TRANSFER (0x0009)
    IRP information: 0x01, Direction: PDO -> FDO
    URB bus id: 1
    Device address: 16
    Endpoint: 0x81, Direction: IN
    URB transfer type: URB_INTERRUPT (0x01)
    Packet Data Length: 8
    [Request in: 66]
    [Time from request: 1.839824000 seconds]
    [bInterfaceClass: HID (0x03)]
HID Data: 20002f0000000000

No.     Time           Source                Destination           Protocol Length Info
     71 11.713787      1.16.1                host                  USB      35     URB_INTERRUPT in

Frame 71: 35 bytes on wire (280 bits), 35 bytes captured (280 bits) on interface wireshark_extcap2640, id 0
USB URB
    [Source: 1.16.1]
    [Destination: host]
    USBPcap pseudoheader length: 27
    IRP ID: 0xffff980edd6bda20
    IRP USBD_STATUS: USBD_STATUS_SUCCESS (0x00000000)
    URB Function: URB_FUNCTION_BULK_OR_INTERRUPT_TRANSFER (0x0009)
    IRP information: 0x01, Direction: PDO -> FDO
    URB bus id: 1
    Device address: 16
    Endpoint: 0x81, Direction: IN
    URB transfer type: URB_INTERRUPT (0x01)
    Packet Data Length: 8
    [Request in: 68]
    [Time from request: 0.479904000 seconds]
    [bInterfaceClass: HID (0x03)]
HID Data: 2000000000000000

No.     Time           Source                Destination           Protocol Length Info
     73 11.793768      1.16.1                host                  USB      35     URB_INTERRUPT in

Frame 73: 35 bytes on wire (280 bits), 35 bytes captured (280 bits) on interface wireshark_extcap2640, id 0
USB URB
    [Source: 1.16.1]
    [Destination: host]
    USBPcap pseudoheader length: 27
    IRP ID: 0xffff980ed6e4ea20
    IRP USBD_STATUS: USBD_STATUS_SUCCESS (0x00000000)
    URB Function: URB_FUNCTION_BULK_OR_INTERRUPT_TRANSFER (0x0009)
    IRP information: 0x01, Direction: PDO -> FDO
    URB bus id: 1
    Device address: 16
    Endpoint: 0x81, Direction: IN
    URB transfer type: URB_INTERRUPT (0x01)
    Packet Data Length: 8
    [Request in: 70]
    [Time from request: 0.231856000 seconds]
    [bInterfaceClass: HID (0x03)]
HID Data: 0000000000000000

No.     Time           Source                Destination           Protocol Length Info
     75 13.489786      1.16.1                host                  USB      35     URB_INTERRUPT in

Frame 75: 35 bytes on wire (280 bits), 35 bytes captured (280 bits) on interface wireshark_extcap2640, id 0
USB URB
    [Source: 1.16.1]
    [Destination: host]
    USBPcap pseudoheader length: 27
    IRP ID: 0xffff980edd6bda20
    IRP USBD_STATUS: USBD_STATUS_SUCCESS (0x00000000)
    URB Function: URB_FUNCTION_BULK_OR_INTERRUPT_TRANSFER (0x0009)
    IRP information: 0x01, Direction: PDO -> FDO
    URB bus id: 1
    Device address: 16
    Endpoint: 0x81, Direction: IN
    URB transfer type: URB_INTERRUPT (0x01)
    Packet Data Length: 8
    [Request in: 72]
    [Time from request: 1.775908000 seconds]
    [bInterfaceClass: HID (0x03)]
HID Data: 0000390000000000

No.     Time           Source                Destination           Protocol Length Info
     79 13.649775      1.16.1                host                  USB      35     URB_INTERRUPT in

Frame 79: 35 bytes on wire (280 bits), 35 bytes captured (280 bits) on interface wireshark_extcap2640, id 0
USB URB
    [Source: 1.16.1]
    [Destination: host]
    USBPcap pseudoheader length: 27
    IRP ID: 0xffff980ed6e4ea20
    IRP USBD_STATUS: USBD_STATUS_SUCCESS (0x00000000)
    URB Function: URB_FUNCTION_BULK_OR_INTERRUPT_TRANSFER (0x0009)
    IRP information: 0x01, Direction: PDO -> FDO
    URB bus id: 1
    Device address: 16
    Endpoint: 0x81, Direction: IN
    URB transfer type: URB_INTERRUPT (0x01)
    Packet Data Length: 8
    [Request in: 74]
    [Time from request: 1.855913000 seconds]
    [bInterfaceClass: HID (0x03)]
HID Data: 0000000000000000

No.     Time           Source                Destination           Protocol Length Info
     81 13.913785      1.16.1                host                  USB      35     URB_INTERRUPT in

Frame 81: 35 bytes on wire (280 bits), 35 bytes captured (280 bits) on interface wireshark_extcap2640, id 0
USB URB
    [Source: 1.16.1]
    [Destination: host]
    USBPcap pseudoheader length: 27
    IRP ID: 0xffff980edd6bda20
    IRP USBD_STATUS: USBD_STATUS_SUCCESS (0x00000000)
    URB Function: URB_FUNCTION_BULK_OR_INTERRUPT_TRANSFER (0x0009)
    IRP information: 0x01, Direction: PDO -> FDO
    URB bus id: 1
    Device address: 16
    Endpoint: 0x81, Direction: IN
    URB transfer type: URB_INTERRUPT (0x01)
    Packet Data Length: 8
    [Request in: 76]
    [Time from request: 0.423906000 seconds]
    [bInterfaceClass: HID (0x03)]
HID Data: 00000c0000000000

No.     Time           Source                Destination           Protocol Length Info
     83 14.057748      1.16.1                host                  USB      35     URB_INTERRUPT in

Frame 83: 35 bytes on wire (280 bits), 35 bytes captured (280 bits) on interface wireshark_extcap2640, id 0
USB URB
    [Source: 1.16.1]
    [Destination: host]
    USBPcap pseudoheader length: 27
    IRP ID: 0xffff980ed6e4ea20
    IRP USBD_STATUS: USBD_STATUS_SUCCESS (0x00000000)
    URB Function: URB_FUNCTION_BULK_OR_INTERRUPT_TRANSFER (0x0009)
    IRP information: 0x01, Direction: PDO -> FDO
    URB bus id: 1
    Device address: 16
    Endpoint: 0x81, Direction: IN
    URB transfer type: URB_INTERRUPT (0x01)
    Packet Data Length: 8
    [Request in: 80]
    [Time from request: 0.407867000 seconds]
    [bInterfaceClass: HID (0x03)]
HID Data: 0000000000000000

No.     Time           Source                Destination           Protocol Length Info
     85 15.113768      1.16.1                host                  USB      35     URB_INTERRUPT in

Frame 85: 35 bytes on wire (280 bits), 35 bytes captured (280 bits) on interface wireshark_extcap2640, id 0
USB URB
    [Source: 1.16.1]
    [Destination: host]
    USBPcap pseudoheader length: 27
    IRP ID: 0xffff980edd6bda20
    IRP USBD_STATUS: USBD_STATUS_SUCCESS (0x00000000)
    URB Function: URB_FUNCTION_BULK_OR_INTERRUPT_TRANSFER (0x0009)
    IRP information: 0x01, Direction: PDO -> FDO
    URB bus id: 1
    Device address: 16
    Endpoint: 0x81, Direction: IN
    URB transfer type: URB_INTERRUPT (0x01)
    Packet Data Length: 8
    [Request in: 82]
    [Time from request: 1.199942000 seconds]
    [bInterfaceClass: HID (0x03)]
HID Data: 2000000000000000

No.     Time           Source                Destination           Protocol Length Info
     87 15.561759      1.16.1                host                  USB      35     URB_INTERRUPT in

Frame 87: 35 bytes on wire (280 bits), 35 bytes captured (280 bits) on interface wireshark_extcap2640, id 0
USB URB
    [Source: 1.16.1]
    [Destination: host]
    USBPcap pseudoheader length: 27
    IRP ID: 0xffff980ed6e4ea20
    IRP USBD_STATUS: USBD_STATUS_SUCCESS (0x00000000)
    URB Function: URB_FUNCTION_BULK_OR_INTERRUPT_TRANSFER (0x0009)
    IRP information: 0x01, Direction: PDO -> FDO
    URB bus id: 1
    Device address: 16
    Endpoint: 0x81, Direction: IN
    URB transfer type: URB_INTERRUPT (0x01)
    Packet Data Length: 8
    [Request in: 84]
    [Time from request: 1.503903000 seconds]
    [bInterfaceClass: HID (0x03)]
HID Data: 20002d0000000000

No.     Time           Source                Destination           Protocol Length Info
     89 15.681893      1.16.1                host                  USB      35     URB_INTERRUPT in

Frame 89: 35 bytes on wire (280 bits), 35 bytes captured (280 bits) on interface wireshark_extcap2640, id 0
USB URB
    [Source: 1.16.1]
    [Destination: host]
    USBPcap pseudoheader length: 27
    IRP ID: 0xffff980edd6bda20
    IRP USBD_STATUS: USBD_STATUS_SUCCESS (0x00000000)
    URB Function: URB_FUNCTION_BULK_OR_INTERRUPT_TRANSFER (0x0009)
    IRP information: 0x01, Direction: PDO -> FDO
    URB bus id: 1
    Device address: 16
    Endpoint: 0x81, Direction: IN
    URB transfer type: URB_INTERRUPT (0x01)
    Packet Data Length: 8
    [Request in: 86]
    [Time from request: 0.568085000 seconds]
    [bInterfaceClass: HID (0x03)]
HID Data: 2000000000000000

No.     Time           Source                Destination           Protocol Length Info
     91 15.769750      1.16.1                host                  USB      35     URB_INTERRUPT in

Frame 91: 35 bytes on wire (280 bits), 35 bytes captured (280 bits) on interface wireshark_extcap2640, id 0
USB URB
    [Source: 1.16.1]
    [Destination: host]
    USBPcap pseudoheader length: 27
    IRP ID: 0xffff980ed6e4ea20
    IRP USBD_STATUS: USBD_STATUS_SUCCESS (0x00000000)
    URB Function: URB_FUNCTION_BULK_OR_INTERRUPT_TRANSFER (0x0009)
    IRP information: 0x01, Direction: PDO -> FDO
    URB bus id: 1
    Device address: 16
    Endpoint: 0x81, Direction: IN
    URB transfer type: URB_INTERRUPT (0x01)
    Packet Data Length: 8
    [Request in: 88]
    [Time from request: 0.207936000 seconds]
    [bInterfaceClass: HID (0x03)]
HID Data: 0000000000000000

No.     Time           Source                Destination           Protocol Length Info
     93 16.865739      1.16.1                host                  USB      35     URB_INTERRUPT in

Frame 93: 35 bytes on wire (280 bits), 35 bytes captured (280 bits) on interface wireshark_extcap2640, id 0
USB URB
    [Source: 1.16.1]
    [Destination: host]
    USBPcap pseudoheader length: 27
    IRP ID: 0xffff980edd6bda20
    IRP USBD_STATUS: USBD_STATUS_SUCCESS (0x00000000)
    URB Function: URB_FUNCTION_BULK_OR_INTERRUPT_TRANSFER (0x0009)
    IRP information: 0x01, Direction: PDO -> FDO
    URB bus id: 1
    Device address: 16
    Endpoint: 0x81, Direction: IN
    URB transfer type: URB_INTERRUPT (0x01)
    Packet Data Length: 8
    [Request in: 90]
    [Time from request: 1.183743000 seconds]
    [bInterfaceClass: HID (0x03)]
HID Data: 0000390000000000

No.     Time           Source                Destination           Protocol Length Info
     97 16.985794      1.16.1                host                  USB      35     URB_INTERRUPT in

Frame 97: 35 bytes on wire (280 bits), 35 bytes captured (280 bits) on interface wireshark_extcap2640, id 0
USB URB
    [Source: 1.16.1]
    [Destination: host]
    USBPcap pseudoheader length: 27
    IRP ID: 0xffff980ed6e4ea20
    IRP USBD_STATUS: USBD_STATUS_SUCCESS (0x00000000)
    URB Function: URB_FUNCTION_BULK_OR_INTERRUPT_TRANSFER (0x0009)
    IRP information: 0x01, Direction: PDO -> FDO
    URB bus id: 1
    Device address: 16
    Endpoint: 0x81, Direction: IN
    URB transfer type: URB_INTERRUPT (0x01)
    Packet Data Length: 8
    [Request in: 92]
    [Time from request: 1.215952000 seconds]
    [bInterfaceClass: HID (0x03)]
HID Data: 0000000000000000

No.     Time           Source                Destination           Protocol Length Info
     99 20.129815      1.16.1                host                  USB      35     URB_INTERRUPT in

Frame 99: 35 bytes on wire (280 bits), 35 bytes captured (280 bits) on interface wireshark_extcap2640, id 0
USB URB
    [Source: 1.16.1]
    [Destination: host]
    USBPcap pseudoheader length: 27
    IRP ID: 0xffff980edd6bda20
    IRP USBD_STATUS: USBD_STATUS_SUCCESS (0x00000000)
    URB Function: URB_FUNCTION_BULK_OR_INTERRUPT_TRANSFER (0x0009)
    IRP information: 0x01, Direction: PDO -> FDO
    URB bus id: 1
    Device address: 16
    Endpoint: 0x81, Direction: IN
    URB transfer type: URB_INTERRUPT (0x01)
    Packet Data Length: 8
    [Request in: 94]
    [Time from request: 3.264009000 seconds]
    [bInterfaceClass: HID (0x03)]
HID Data: 0000060000000000

No.     Time           Source                Destination           Protocol Length Info
    101 20.345864      1.16.1                host                  USB      35     URB_INTERRUPT in

Frame 101: 35 bytes on wire (280 bits), 35 bytes captured (280 bits) on interface wireshark_extcap2640, id 0
USB URB
    [Source: 1.16.1]
    [Destination: host]
    USBPcap pseudoheader length: 27
    IRP ID: 0xffff980ed6e4ea20
    IRP USBD_STATUS: USBD_STATUS_SUCCESS (0x00000000)
    URB Function: URB_FUNCTION_BULK_OR_INTERRUPT_TRANSFER (0x0009)
    IRP information: 0x01, Direction: PDO -> FDO
    URB bus id: 1
    Device address: 16
    Endpoint: 0x81, Direction: IN
    URB transfer type: URB_INTERRUPT (0x01)
    Packet Data Length: 8
    [Request in: 98]
    [Time from request: 3.360005000 seconds]
    [bInterfaceClass: HID (0x03)]
HID Data: 0000000000000000

No.     Time           Source                Destination           Protocol Length Info
    103 21.673767      1.16.1                host                  USB      35     URB_INTERRUPT in

Frame 103: 35 bytes on wire (280 bits), 35 bytes captured (280 bits) on interface wireshark_extcap2640, id 0
USB URB
    [Source: 1.16.1]
    [Destination: host]
    USBPcap pseudoheader length: 27
    IRP ID: 0xffff980edd6bda20
    IRP USBD_STATUS: USBD_STATUS_SUCCESS (0x00000000)
    URB Function: URB_FUNCTION_BULK_OR_INTERRUPT_TRANSFER (0x0009)
    IRP information: 0x01, Direction: PDO -> FDO
    URB bus id: 1
    Device address: 16
    Endpoint: 0x81, Direction: IN
    URB transfer type: URB_INTERRUPT (0x01)
    Packet Data Length: 8
    [Request in: 100]
    [Time from request: 1.543907000 seconds]
    [bInterfaceClass: HID (0x03)]
HID Data: 0000210000000000

No.     Time           Source                Destination           Protocol Length Info
    105 21.785776      1.16.1                host                  USB      35     URB_INTERRUPT in

Frame 105: 35 bytes on wire (280 bits), 35 bytes captured (280 bits) on interface wireshark_extcap2640, id 0
USB URB
    [Source: 1.16.1]
    [Destination: host]
    USBPcap pseudoheader length: 27
    IRP ID: 0xffff980ed6e4ea20
    IRP USBD_STATUS: USBD_STATUS_SUCCESS (0x00000000)
    URB Function: URB_FUNCTION_BULK_OR_INTERRUPT_TRANSFER (0x0009)
    IRP information: 0x01, Direction: PDO -> FDO
    URB bus id: 1
    Device address: 16
    Endpoint: 0x81, Direction: IN
    URB transfer type: URB_INTERRUPT (0x01)
    Packet Data Length: 8
    [Request in: 102]
    [Time from request: 1.439815000 seconds]
    [bInterfaceClass: HID (0x03)]
HID Data: 0000000000000000

No.     Time           Source                Destination           Protocol Length Info
    107 22.657773      1.16.1                host                  USB      35     URB_INTERRUPT in

Frame 107: 35 bytes on wire (280 bits), 35 bytes captured (280 bits) on interface wireshark_extcap2640, id 0
USB URB
    [Source: 1.16.1]
    [Destination: host]
    USBPcap pseudoheader length: 27
    IRP ID: 0xffff980edd6bda20
    IRP USBD_STATUS: USBD_STATUS_SUCCESS (0x00000000)
    URB Function: URB_FUNCTION_BULK_OR_INTERRUPT_TRANSFER (0x0009)
    IRP information: 0x01, Direction: PDO -> FDO
    URB bus id: 1
    Device address: 16
    Endpoint: 0x81, Direction: IN
    URB transfer type: URB_INTERRUPT (0x01)
    Packet Data Length: 8
    [Request in: 104]
    [Time from request: 0.983907000 seconds]
    [bInterfaceClass: HID (0x03)]
HID Data: 0000110000000000

No.     Time           Source                Destination           Protocol Length Info
    109 22.849766      1.16.1                host                  USB      35     URB_INTERRUPT in

Frame 109: 35 bytes on wire (280 bits), 35 bytes captured (280 bits) on interface wireshark_extcap2640, id 0
USB URB
    [Source: 1.16.1]
    [Destination: host]
    USBPcap pseudoheader length: 27
    IRP ID: 0xffff980ed6e4ea20
    IRP USBD_STATUS: USBD_STATUS_SUCCESS (0x00000000)
    URB Function: URB_FUNCTION_BULK_OR_INTERRUPT_TRANSFER (0x0009)
    IRP information: 0x01, Direction: PDO -> FDO
    URB bus id: 1
    Device address: 16
    Endpoint: 0x81, Direction: IN
    URB transfer type: URB_INTERRUPT (0x01)
    Packet Data Length: 8
    [Request in: 106]
    [Time from request: 1.063898000 seconds]
    [bInterfaceClass: HID (0x03)]
HID Data: 0000000000000000

No.     Time           Source                Destination           Protocol Length Info
    111 23.977765      1.16.1                host                  USB      35     URB_INTERRUPT in

Frame 111: 35 bytes on wire (280 bits), 35 bytes captured (280 bits) on interface wireshark_extcap2640, id 0
USB URB
    [Source: 1.16.1]
    [Destination: host]
    USBPcap pseudoheader length: 27
    IRP ID: 0xffff980edd6bda20
    IRP USBD_STATUS: USBD_STATUS_SUCCESS (0x00000000)
    URB Function: URB_FUNCTION_BULK_OR_INTERRUPT_TRANSFER (0x0009)
    IRP information: 0x01, Direction: PDO -> FDO
    URB bus id: 1
    Device address: 16
    Endpoint: 0x81, Direction: IN
    URB transfer type: URB_INTERRUPT (0x01)
    Packet Data Length: 8
    [Request in: 108]
    [Time from request: 1.319896000 seconds]
    [bInterfaceClass: HID (0x03)]
HID Data: 2000000000000000

No.     Time           Source                Destination           Protocol Length Info
    113 24.265914      1.16.1                host                  USB      35     URB_INTERRUPT in

Frame 113: 35 bytes on wire (280 bits), 35 bytes captured (280 bits) on interface wireshark_extcap2640, id 0
USB URB
    [Source: 1.16.1]
    [Destination: host]
    USBPcap pseudoheader length: 27
    IRP ID: 0xffff980ed6e4ea20
    IRP USBD_STATUS: USBD_STATUS_SUCCESS (0x00000000)
    URB Function: URB_FUNCTION_BULK_OR_INTERRUPT_TRANSFER (0x0009)
    IRP information: 0x01, Direction: PDO -> FDO
    URB bus id: 1
    Device address: 16
    Endpoint: 0x81, Direction: IN
    URB transfer type: URB_INTERRUPT (0x01)
    Packet Data Length: 8
    [Request in: 110]
    [Time from request: 1.416063000 seconds]
    [bInterfaceClass: HID (0x03)]
HID Data: 20002d0000000000

No.     Time           Source                Destination           Protocol Length Info
    115 24.457740      1.16.1                host                  USB      35     URB_INTERRUPT in

Frame 115: 35 bytes on wire (280 bits), 35 bytes captured (280 bits) on interface wireshark_extcap2640, id 0
USB URB
    [Source: 1.16.1]
    [Destination: host]
    USBPcap pseudoheader length: 27
    IRP ID: 0xffff980edd6bda20
    IRP USBD_STATUS: USBD_STATUS_SUCCESS (0x00000000)
    URB Function: URB_FUNCTION_BULK_OR_INTERRUPT_TRANSFER (0x0009)
    IRP information: 0x01, Direction: PDO -> FDO
    URB bus id: 1
    Device address: 16
    Endpoint: 0x81, Direction: IN
    URB transfer type: URB_INTERRUPT (0x01)
    Packet Data Length: 8
    [Request in: 112]
    [Time from request: 0.479919000 seconds]
    [bInterfaceClass: HID (0x03)]
HID Data: 2000000000000000

No.     Time           Source                Destination           Protocol Length Info
    117 24.513772      1.16.1                host                  USB      35     URB_INTERRUPT in

Frame 117: 35 bytes on wire (280 bits), 35 bytes captured (280 bits) on interface wireshark_extcap2640, id 0
USB URB
    [Source: 1.16.1]
    [Destination: host]
    USBPcap pseudoheader length: 27
    IRP ID: 0xffff980ed6e4ea20
    IRP USBD_STATUS: USBD_STATUS_SUCCESS (0x00000000)
    URB Function: URB_FUNCTION_BULK_OR_INTERRUPT_TRANSFER (0x0009)
    IRP information: 0x01, Direction: PDO -> FDO
    URB bus id: 1
    Device address: 16
    Endpoint: 0x81, Direction: IN
    URB transfer type: URB_INTERRUPT (0x01)
    Packet Data Length: 8
    [Request in: 114]
    [Time from request: 0.247755000 seconds]
    [bInterfaceClass: HID (0x03)]
HID Data: 0000000000000000

No.     Time           Source                Destination           Protocol Length Info
    119 27.737754      1.16.1                host                  USB      35     URB_INTERRUPT in

Frame 119: 35 bytes on wire (280 bits), 35 bytes captured (280 bits) on interface wireshark_extcap2640, id 0
USB URB
    [Source: 1.16.1]
    [Destination: host]
    USBPcap pseudoheader length: 27
    IRP ID: 0xffff980edd6bda20
    IRP USBD_STATUS: USBD_STATUS_SUCCESS (0x00000000)
    URB Function: URB_FUNCTION_BULK_OR_INTERRUPT_TRANSFER (0x0009)
    IRP information: 0x01, Direction: PDO -> FDO
    URB bus id: 1
    Device address: 16
    Endpoint: 0x81, Direction: IN
    URB transfer type: URB_INTERRUPT (0x01)
    Packet Data Length: 8
    [Request in: 116]
    [Time from request: 3.279913000 seconds]
    [bInterfaceClass: HID (0x03)]
HID Data: 0000220000000000

No.     Time           Source                Destination           Protocol Length Info
    121 27.833735      1.16.1                host                  USB      35     URB_INTERRUPT in

Frame 121: 35 bytes on wire (280 bits), 35 bytes captured (280 bits) on interface wireshark_extcap2640, id 0
USB URB
    [Source: 1.16.1]
    [Destination: host]
    USBPcap pseudoheader length: 27
    IRP ID: 0xffff980ed6e4ea20
    IRP USBD_STATUS: USBD_STATUS_SUCCESS (0x00000000)
    URB Function: URB_FUNCTION_BULK_OR_INTERRUPT_TRANSFER (0x0009)
    IRP information: 0x01, Direction: PDO -> FDO
    URB bus id: 1
    Device address: 16
    Endpoint: 0x81, Direction: IN
    URB transfer type: URB_INTERRUPT (0x01)
    Packet Data Length: 8
    [Request in: 118]
    [Time from request: 3.319911000 seconds]
    [bInterfaceClass: HID (0x03)]
HID Data: 0000000000000000

No.     Time           Source                Destination           Protocol Length Info
    123 28.225733      1.16.1                host                  USB      35     URB_INTERRUPT in

Frame 123: 35 bytes on wire (280 bits), 35 bytes captured (280 bits) on interface wireshark_extcap2640, id 0
USB URB
    [Source: 1.16.1]
    [Destination: host]
    USBPcap pseudoheader length: 27
    IRP ID: 0xffff980edd6bda20
    IRP USBD_STATUS: USBD_STATUS_SUCCESS (0x00000000)
    URB Function: URB_FUNCTION_BULK_OR_INTERRUPT_TRANSFER (0x0009)
    IRP information: 0x01, Direction: PDO -> FDO
    URB bus id: 1
    Device address: 16
    Endpoint: 0x81, Direction: IN
    URB transfer type: URB_INTERRUPT (0x01)
    Packet Data Length: 8
    [Request in: 120]
    [Time from request: 0.487919000 seconds]
    [bInterfaceClass: HID (0x03)]
HID Data: 0000200000000000

No.     Time           Source                Destination           Protocol Length Info
    125 28.385794      1.16.1                host                  USB      35     URB_INTERRUPT in

Frame 125: 35 bytes on wire (280 bits), 35 bytes captured (280 bits) on interface wireshark_extcap2640, id 0
USB URB
    [Source: 1.16.1]
    [Destination: host]
    USBPcap pseudoheader length: 27
    IRP ID: 0xffff980ed6e4ea20
    IRP USBD_STATUS: USBD_STATUS_SUCCESS (0x00000000)
    URB Function: URB_FUNCTION_BULK_OR_INTERRUPT_TRANSFER (0x0009)
    IRP information: 0x01, Direction: PDO -> FDO
    URB bus id: 1
    Device address: 16
    Endpoint: 0x81, Direction: IN
    URB transfer type: URB_INTERRUPT (0x01)
    Packet Data Length: 8
    [Request in: 122]
    [Time from request: 0.551968000 seconds]
    [bInterfaceClass: HID (0x03)]
HID Data: 0000000000000000

No.     Time           Source                Destination           Protocol Length Info
    127 28.585776      1.16.1                host                  USB      35     URB_INTERRUPT in

Frame 127: 35 bytes on wire (280 bits), 35 bytes captured (280 bits) on interface wireshark_extcap2640, id 0
USB URB
    [Source: 1.16.1]
    [Destination: host]
    USBPcap pseudoheader length: 27
    IRP ID: 0xffff980edd6bda20
    IRP USBD_STATUS: USBD_STATUS_SUCCESS (0x00000000)
    URB Function: URB_FUNCTION_BULK_OR_INTERRUPT_TRANSFER (0x0009)
    IRP information: 0x01, Direction: PDO -> FDO
    URB bus id: 1
    Device address: 16
    Endpoint: 0x81, Direction: IN
    URB transfer type: URB_INTERRUPT (0x01)
    Packet Data Length: 8
    [Request in: 124]
    [Time from request: 0.359956000 seconds]
    [bInterfaceClass: HID (0x03)]
HID Data: 0000200000000000

No.     Time           Source                Destination           Protocol Length Info
    129 28.753792      1.16.1                host                  USB      35     URB_INTERRUPT in

Frame 129: 35 bytes on wire (280 bits), 35 bytes captured (280 bits) on interface wireshark_extcap2640, id 0
USB URB
    [Source: 1.16.1]
    [Destination: host]
    USBPcap pseudoheader length: 27
    IRP ID: 0xffff980ed6e4ea20
    IRP USBD_STATUS: USBD_STATUS_SUCCESS (0x00000000)
    URB Function: URB_FUNCTION_BULK_OR_INTERRUPT_TRANSFER (0x0009)
    IRP information: 0x01, Direction: PDO -> FDO
    URB bus id: 1
    Device address: 16
    Endpoint: 0x81, Direction: IN
    URB transfer type: URB_INTERRUPT (0x01)
    Packet Data Length: 8
    [Request in: 126]
    [Time from request: 0.367899000 seconds]
    [bInterfaceClass: HID (0x03)]
HID Data: 0000000000000000

No.     Time           Source                Destination           Protocol Length Info
    131 29.953785      1.16.1                host                  USB      35     URB_INTERRUPT in

Frame 131: 35 bytes on wire (280 bits), 35 bytes captured (280 bits) on interface wireshark_extcap2640, id 0
USB URB
    [Source: 1.16.1]
    [Destination: host]
    USBPcap pseudoheader length: 27
    IRP ID: 0xffff980edd6bda20
    IRP USBD_STATUS: USBD_STATUS_SUCCESS (0x00000000)
    URB Function: URB_FUNCTION_BULK_OR_INTERRUPT_TRANSFER (0x0009)
    IRP information: 0x01, Direction: PDO -> FDO
    URB bus id: 1
    Device address: 16
    Endpoint: 0x81, Direction: IN
    URB transfer type: URB_INTERRUPT (0x01)
    Packet Data Length: 8
    [Request in: 128]
    [Time from request: 1.367908000 seconds]
    [bInterfaceClass: HID (0x03)]
HID Data: 2000000000000000

No.     Time           Source                Destination           Protocol Length Info
    133 30.361755      1.16.1                host                  USB      35     URB_INTERRUPT in

Frame 133: 35 bytes on wire (280 bits), 35 bytes captured (280 bits) on interface wireshark_extcap2640, id 0
USB URB
    [Source: 1.16.1]
    [Destination: host]
    USBPcap pseudoheader length: 27
    IRP ID: 0xffff980ed6e4ea20
    IRP USBD_STATUS: USBD_STATUS_SUCCESS (0x00000000)
    URB Function: URB_FUNCTION_BULK_OR_INTERRUPT_TRANSFER (0x0009)
    IRP information: 0x01, Direction: PDO -> FDO
    URB bus id: 1
    Device address: 16
    Endpoint: 0x81, Direction: IN
    URB transfer type: URB_INTERRUPT (0x01)
    Packet Data Length: 8
    [Request in: 130]
    [Time from request: 1.607867000 seconds]
    [bInterfaceClass: HID (0x03)]
HID Data: 20002d0000000000

No.     Time           Source                Destination           Protocol Length Info
    135 30.561776      1.16.1                host                  USB      35     URB_INTERRUPT in

Frame 135: 35 bytes on wire (280 bits), 35 bytes captured (280 bits) on interface wireshark_extcap2640, id 0
USB URB
    [Source: 1.16.1]
    [Destination: host]
    USBPcap pseudoheader length: 27
    IRP ID: 0xffff980edd6bda20
    IRP USBD_STATUS: USBD_STATUS_SUCCESS (0x00000000)
    URB Function: URB_FUNCTION_BULK_OR_INTERRUPT_TRANSFER (0x0009)
    IRP information: 0x01, Direction: PDO -> FDO
    URB bus id: 1
    Device address: 16
    Endpoint: 0x81, Direction: IN
    URB transfer type: URB_INTERRUPT (0x01)
    Packet Data Length: 8
    [Request in: 132]
    [Time from request: 0.607892000 seconds]
    [bInterfaceClass: HID (0x03)]
HID Data: 2000000000000000

No.     Time           Source                Destination           Protocol Length Info
    137 30.649755      1.16.1                host                  USB      35     URB_INTERRUPT in

Frame 137: 35 bytes on wire (280 bits), 35 bytes captured (280 bits) on interface wireshark_extcap2640, id 0
USB URB
    [Source: 1.16.1]
    [Destination: host]
    USBPcap pseudoheader length: 27
    IRP ID: 0xffff980ed6e4ea20
    IRP USBD_STATUS: USBD_STATUS_SUCCESS (0x00000000)
    URB Function: URB_FUNCTION_BULK_OR_INTERRUPT_TRANSFER (0x0009)
    IRP information: 0x01, Direction: PDO -> FDO
    URB bus id: 1
    Device address: 16
    Endpoint: 0x81, Direction: IN
    URB transfer type: URB_INTERRUPT (0x01)
    Packet Data Length: 8
    [Request in: 134]
    [Time from request: 0.287906000 seconds]
    [bInterfaceClass: HID (0x03)]
HID Data: 0000000000000000

No.     Time           Source                Destination           Protocol Length Info
    139 31.161797      1.16.1                host                  USB      35     URB_INTERRUPT in

Frame 139: 35 bytes on wire (280 bits), 35 bytes captured (280 bits) on interface wireshark_extcap2640, id 0
USB URB
    [Source: 1.16.1]
    [Destination: host]
    USBPcap pseudoheader length: 27
    IRP ID: 0xffff980edd6bda20
    IRP USBD_STATUS: USBD_STATUS_SUCCESS (0x00000000)
    URB Function: URB_FUNCTION_BULK_OR_INTERRUPT_TRANSFER (0x0009)
    IRP information: 0x01, Direction: PDO -> FDO
    URB bus id: 1
    Device address: 16
    Endpoint: 0x81, Direction: IN
    URB transfer type: URB_INTERRUPT (0x01)
    Packet Data Length: 8
    [Request in: 136]
    [Time from request: 0.599930000 seconds]
    [bInterfaceClass: HID (0x03)]
HID Data: 0000390000000000

No.     Time           Source                Destination           Protocol Length Info
    143 31.321774      1.16.1                host                  USB      35     URB_INTERRUPT in

Frame 143: 35 bytes on wire (280 bits), 35 bytes captured (280 bits) on interface wireshark_extcap2640, id 0
USB URB
    [Source: 1.16.1]
    [Destination: host]
    USBPcap pseudoheader length: 27
    IRP ID: 0xffff980ed6e4ea20
    IRP USBD_STATUS: USBD_STATUS_SUCCESS (0x00000000)
    URB Function: URB_FUNCTION_BULK_OR_INTERRUPT_TRANSFER (0x0009)
    IRP information: 0x01, Direction: PDO -> FDO
    URB bus id: 1
    Device address: 16
    Endpoint: 0x81, Direction: IN
    URB transfer type: URB_INTERRUPT (0x01)
    Packet Data Length: 8
    [Request in: 138]
    [Time from request: 0.671975000 seconds]
    [bInterfaceClass: HID (0x03)]
HID Data: 0000000000000000

No.     Time           Source                Destination           Protocol Length Info
    145 32.577771      1.16.1                host                  USB      35     URB_INTERRUPT in

Frame 145: 35 bytes on wire (280 bits), 35 bytes captured (280 bits) on interface wireshark_extcap2640, id 0
USB URB
    [Source: 1.16.1]
    [Destination: host]
    USBPcap pseudoheader length: 27
    IRP ID: 0xffff980edd6bda20
    IRP USBD_STATUS: USBD_STATUS_SUCCESS (0x00000000)
    URB Function: URB_FUNCTION_BULK_OR_INTERRUPT_TRANSFER (0x0009)
    IRP information: 0x01, Direction: PDO -> FDO
    URB bus id: 1
    Device address: 16
    Endpoint: 0x81, Direction: IN
    URB transfer type: URB_INTERRUPT (0x01)
    Packet Data Length: 8
    [Request in: 140]
    [Time from request: 1.415931000 seconds]
    [bInterfaceClass: HID (0x03)]
HID Data: 00001c0000000000

No.     Time           Source                Destination           Protocol Length Info
    147 32.761762      1.16.1                host                  USB      35     URB_INTERRUPT in

Frame 147: 35 bytes on wire (280 bits), 35 bytes captured (280 bits) on interface wireshark_extcap2640, id 0
USB URB
    [Source: 1.16.1]
    [Destination: host]
    USBPcap pseudoheader length: 27
    IRP ID: 0xffff980ed6e4ea20
    IRP USBD_STATUS: USBD_STATUS_SUCCESS (0x00000000)
    URB Function: URB_FUNCTION_BULK_OR_INTERRUPT_TRANSFER (0x0009)
    IRP information: 0x01, Direction: PDO -> FDO
    URB bus id: 1
    Device address: 16
    Endpoint: 0x81, Direction: IN
    URB transfer type: URB_INTERRUPT (0x01)
    Packet Data Length: 8
    [Request in: 144]
    [Time from request: 1.439901000 seconds]
    [bInterfaceClass: HID (0x03)]
HID Data: 0000000000000000

No.     Time           Source                Destination           Protocol Length Info
    149 35.097778      1.16.1                host                  USB      35     URB_INTERRUPT in

Frame 149: 35 bytes on wire (280 bits), 35 bytes captured (280 bits) on interface wireshark_extcap2640, id 0
USB URB
    [Source: 1.16.1]
    [Destination: host]
    USBPcap pseudoheader length: 27
    IRP ID: 0xffff980edd6bda20
    IRP USBD_STATUS: USBD_STATUS_SUCCESS (0x00000000)
    URB Function: URB_FUNCTION_BULK_OR_INTERRUPT_TRANSFER (0x0009)
    IRP information: 0x01, Direction: PDO -> FDO
    URB bus id: 1
    Device address: 16
    Endpoint: 0x81, Direction: IN
    URB transfer type: URB_INTERRUPT (0x01)
    Packet Data Length: 8
    [Request in: 146]
    [Time from request: 2.519899000 seconds]
    [bInterfaceClass: HID (0x03)]
HID Data: 0000390000000000

No.     Time           Source                Destination           Protocol Length Info
    153 35.249760      1.16.1                host                  USB      35     URB_INTERRUPT in

Frame 153: 35 bytes on wire (280 bits), 35 bytes captured (280 bits) on interface wireshark_extcap2640, id 0
USB URB
    [Source: 1.16.1]
    [Destination: host]
    USBPcap pseudoheader length: 27
    IRP ID: 0xffff980ed6e4ea20
    IRP USBD_STATUS: USBD_STATUS_SUCCESS (0x00000000)
    URB Function: URB_FUNCTION_BULK_OR_INTERRUPT_TRANSFER (0x0009)
    IRP information: 0x01, Direction: PDO -> FDO
    URB bus id: 1
    Device address: 16
    Endpoint: 0x81, Direction: IN
    URB transfer type: URB_INTERRUPT (0x01)
    Packet Data Length: 8
    [Request in: 148]
    [Time from request: 2.487903000 seconds]
    [bInterfaceClass: HID (0x03)]
HID Data: 0000000000000000

No.     Time           Source                Destination           Protocol Length Info
    155 35.521746      1.16.1                host                  USB      35     URB_INTERRUPT in

Frame 155: 35 bytes on wire (280 bits), 35 bytes captured (280 bits) on interface wireshark_extcap2640, id 0
USB URB
    [Source: 1.16.1]
    [Destination: host]
    USBPcap pseudoheader length: 27
    IRP ID: 0xffff980edd6bda20
    IRP USBD_STATUS: USBD_STATUS_SUCCESS (0x00000000)
    URB Function: URB_FUNCTION_BULK_OR_INTERRUPT_TRANSFER (0x0009)
    IRP information: 0x01, Direction: PDO -> FDO
    URB bus id: 1
    Device address: 16
    Endpoint: 0x81, Direction: IN
    URB transfer type: URB_INTERRUPT (0x01)
    Packet Data Length: 8
    [Request in: 150]
    [Time from request: 0.423785000 seconds]
    [bInterfaceClass: HID (0x03)]
HID Data: 0000120000000000

No.     Time           Source                Destination           Protocol Length Info
    157 35.769741      1.16.1                host                  USB      35     URB_INTERRUPT in

Frame 157: 35 bytes on wire (280 bits), 35 bytes captured (280 bits) on interface wireshark_extcap2640, id 0
USB URB
    [Source: 1.16.1]
    [Destination: host]
    USBPcap pseudoheader length: 27
    IRP ID: 0xffff980ed6e4ea20
    IRP USBD_STATUS: USBD_STATUS_SUCCESS (0x00000000)
    URB Function: URB_FUNCTION_BULK_OR_INTERRUPT_TRANSFER (0x0009)
    IRP information: 0x01, Direction: PDO -> FDO
    URB bus id: 1
    Device address: 16
    Endpoint: 0x81, Direction: IN
    URB transfer type: URB_INTERRUPT (0x01)
    Packet Data Length: 8
    [Request in: 154]
    [Time from request: 0.519884000 seconds]
    [bInterfaceClass: HID (0x03)]
HID Data: 0000000000000000

No.     Time           Source                Destination           Protocol Length Info
    159 39.577758      1.16.1                host                  USB      35     URB_INTERRUPT in

Frame 159: 35 bytes on wire (280 bits), 35 bytes captured (280 bits) on interface wireshark_extcap2640, id 0
USB URB
    [Source: 1.16.1]
    [Destination: host]
    USBPcap pseudoheader length: 27
    IRP ID: 0xffff980edd6bda20
    IRP USBD_STATUS: USBD_STATUS_SUCCESS (0x00000000)
    URB Function: URB_FUNCTION_BULK_OR_INTERRUPT_TRANSFER (0x0009)
    IRP information: 0x01, Direction: PDO -> FDO
    URB bus id: 1
    Device address: 16
    Endpoint: 0x81, Direction: IN
    URB transfer type: URB_INTERRUPT (0x01)
    Packet Data Length: 8
    [Request in: 156]
    [Time from request: 4.055972000 seconds]
    [bInterfaceClass: HID (0x03)]
HID Data: 0000180000000000

No.     Time           Source                Destination           Protocol Length Info
    161 39.793765      1.16.1                host                  USB      35     URB_INTERRUPT in

Frame 161: 35 bytes on wire (280 bits), 35 bytes captured (280 bits) on interface wireshark_extcap2640, id 0
USB URB
    [Source: 1.16.1]
    [Destination: host]
    USBPcap pseudoheader length: 27
    IRP ID: 0xffff980ed6e4ea20
    IRP USBD_STATUS: USBD_STATUS_SUCCESS (0x00000000)
    URB Function: URB_FUNCTION_BULK_OR_INTERRUPT_TRANSFER (0x0009)
    IRP information: 0x01, Direction: PDO -> FDO
    URB bus id: 1
    Device address: 16
    Endpoint: 0x81, Direction: IN
    URB transfer type: URB_INTERRUPT (0x01)
    Packet Data Length: 8
    [Request in: 158]
    [Time from request: 4.023931000 seconds]
    [bInterfaceClass: HID (0x03)]
HID Data: 0000000000000000

No.     Time           Source                Destination           Protocol Length Info
    163 39.937846      1.16.1                host                  USB      35     URB_INTERRUPT in

Frame 163: 35 bytes on wire (280 bits), 35 bytes captured (280 bits) on interface wireshark_extcap2640, id 0
USB URB
    [Source: 1.16.1]
    [Destination: host]
    USBPcap pseudoheader length: 27
    IRP ID: 0xffff980edd6bda20
    IRP USBD_STATUS: USBD_STATUS_SUCCESS (0x00000000)
    URB Function: URB_FUNCTION_BULK_OR_INTERRUPT_TRANSFER (0x0009)
    IRP information: 0x01, Direction: PDO -> FDO
    URB bus id: 1
    Device address: 16
    Endpoint: 0x81, Direction: IN
    URB transfer type: URB_INTERRUPT (0x01)
    Packet Data Length: 8
    [Request in: 160]
    [Time from request: 0.359979000 seconds]
    [bInterfaceClass: HID (0x03)]
HID Data: 0000390000000000

No.     Time           Source                Destination           Protocol Length Info
    167 40.049759      1.16.1                host                  USB      35     URB_INTERRUPT in

Frame 167: 35 bytes on wire (280 bits), 35 bytes captured (280 bits) on interface wireshark_extcap2640, id 0
USB URB
    [Source: 1.16.1]
    [Destination: host]
    USBPcap pseudoheader length: 27
    IRP ID: 0xffff980ed6e4ea20
    IRP USBD_STATUS: USBD_STATUS_SUCCESS (0x00000000)
    URB Function: URB_FUNCTION_BULK_OR_INTERRUPT_TRANSFER (0x0009)
    IRP information: 0x01, Direction: PDO -> FDO
    URB bus id: 1
    Device address: 16
    Endpoint: 0x81, Direction: IN
    URB transfer type: URB_INTERRUPT (0x01)
    Packet Data Length: 8
    [Request in: 162]
    [Time from request: 0.255919000 seconds]
    [bInterfaceClass: HID (0x03)]
HID Data: 0000000000000000

No.     Time           Source                Destination           Protocol Length Info
    169 40.649707      1.16.1                host                  USB      35     URB_INTERRUPT in

Frame 169: 35 bytes on wire (280 bits), 35 bytes captured (280 bits) on interface wireshark_extcap2640, id 0
USB URB
    [Source: 1.16.1]
    [Destination: host]
    USBPcap pseudoheader length: 27
    IRP ID: 0xffff980edd6bda20
    IRP USBD_STATUS: USBD_STATUS_SUCCESS (0x00000000)
    URB Function: URB_FUNCTION_BULK_OR_INTERRUPT_TRANSFER (0x0009)
    IRP information: 0x01, Direction: PDO -> FDO
    URB bus id: 1
    Device address: 16
    Endpoint: 0x81, Direction: IN
    URB transfer type: URB_INTERRUPT (0x01)
    Packet Data Length: 8
    [Request in: 164]
    [Time from request: 0.711752000 seconds]
    [bInterfaceClass: HID (0x03)]
HID Data: 0000150000000000

No.     Time           Source                Destination           Protocol Length Info
    171 40.833718      1.16.1                host                  USB      35     URB_INTERRUPT in

Frame 171: 35 bytes on wire (280 bits), 35 bytes captured (280 bits) on interface wireshark_extcap2640, id 0
USB URB
    [Source: 1.16.1]
    [Destination: host]
    USBPcap pseudoheader length: 27
    IRP ID: 0xffff980ed6e4ea20
    IRP USBD_STATUS: USBD_STATUS_SUCCESS (0x00000000)
    URB Function: URB_FUNCTION_BULK_OR_INTERRUPT_TRANSFER (0x0009)
    IRP information: 0x01, Direction: PDO -> FDO
    URB bus id: 1
    Device address: 16
    Endpoint: 0x81, Direction: IN
    URB transfer type: URB_INTERRUPT (0x01)
    Packet Data Length: 8
    [Request in: 168]
    [Time from request: 0.783857000 seconds]
    [bInterfaceClass: HID (0x03)]
HID Data: 0000000000000000

No.     Time           Source                Destination           Protocol Length Info
    173 41.841734      1.16.1                host                  USB      35     URB_INTERRUPT in

Frame 173: 35 bytes on wire (280 bits), 35 bytes captured (280 bits) on interface wireshark_extcap2640, id 0
USB URB
    [Source: 1.16.1]
    [Destination: host]
    USBPcap pseudoheader length: 27
    IRP ID: 0xffff980edd6bda20
    IRP USBD_STATUS: USBD_STATUS_SUCCESS (0x00000000)
    URB Function: URB_FUNCTION_BULK_OR_INTERRUPT_TRANSFER (0x0009)
    IRP information: 0x01, Direction: PDO -> FDO
    URB bus id: 1
    Device address: 16
    Endpoint: 0x81, Direction: IN
    URB transfer type: URB_INTERRUPT (0x01)
    Packet Data Length: 8
    [Request in: 170]
    [Time from request: 1.191962000 seconds]
    [bInterfaceClass: HID (0x03)]
HID Data: 2000000000000000

No.     Time           Source                Destination           Protocol Length Info
    175 42.217767      1.16.1                host                  USB      35     URB_INTERRUPT in

Frame 175: 35 bytes on wire (280 bits), 35 bytes captured (280 bits) on interface wireshark_extcap2640, id 0
USB URB
    [Source: 1.16.1]
    [Destination: host]
    USBPcap pseudoheader length: 27
    IRP ID: 0xffff980ed6e4ea20
    IRP USBD_STATUS: USBD_STATUS_SUCCESS (0x00000000)
    URB Function: URB_FUNCTION_BULK_OR_INTERRUPT_TRANSFER (0x0009)
    IRP information: 0x01, Direction: PDO -> FDO
    URB bus id: 1
    Device address: 16
    Endpoint: 0x81, Direction: IN
    URB transfer type: URB_INTERRUPT (0x01)
    Packet Data Length: 8
    [Request in: 172]
    [Time from request: 1.384009000 seconds]
    [bInterfaceClass: HID (0x03)]
HID Data: 20002d0000000000

No.     Time           Source                Destination           Protocol Length Info
    177 42.425785      1.16.1                host                  USB      35     URB_INTERRUPT in

Frame 177: 35 bytes on wire (280 bits), 35 bytes captured (280 bits) on interface wireshark_extcap2640, id 0
USB URB
    [Source: 1.16.1]
    [Destination: host]
    USBPcap pseudoheader length: 27
    IRP ID: 0xffff980edd6bda20
    IRP USBD_STATUS: USBD_STATUS_SUCCESS (0x00000000)
    URB Function: URB_FUNCTION_BULK_OR_INTERRUPT_TRANSFER (0x0009)
    IRP information: 0x01, Direction: PDO -> FDO
    URB bus id: 1
    Device address: 16
    Endpoint: 0x81, Direction: IN
    URB transfer type: URB_INTERRUPT (0x01)
    Packet Data Length: 8
    [Request in: 174]
    [Time from request: 0.584010000 seconds]
    [bInterfaceClass: HID (0x03)]
HID Data: 2000000000000000

No.     Time           Source                Destination           Protocol Length Info
    179 42.497715      1.16.1                host                  USB      35     URB_INTERRUPT in

Frame 179: 35 bytes on wire (280 bits), 35 bytes captured (280 bits) on interface wireshark_extcap2640, id 0
USB URB
    [Source: 1.16.1]
    [Destination: host]
    USBPcap pseudoheader length: 27
    IRP ID: 0xffff980ed6e4ea20
    IRP USBD_STATUS: USBD_STATUS_SUCCESS (0x00000000)
    URB Function: URB_FUNCTION_BULK_OR_INTERRUPT_TRANSFER (0x0009)
    IRP information: 0x01, Direction: PDO -> FDO
    URB bus id: 1
    Device address: 16
    Endpoint: 0x81, Direction: IN
    URB transfer type: URB_INTERRUPT (0x01)
    Packet Data Length: 8
    [Request in: 176]
    [Time from request: 0.279906000 seconds]
    [bInterfaceClass: HID (0x03)]
HID Data: 0000000000000000

No.     Time           Source                Destination           Protocol Length Info
    181 44.489735      1.16.1                host                  USB      35     URB_INTERRUPT in

Frame 181: 35 bytes on wire (280 bits), 35 bytes captured (280 bits) on interface wireshark_extcap2640, id 0
USB URB
    [Source: 1.16.1]
    [Destination: host]
    USBPcap pseudoheader length: 27
    IRP ID: 0xffff980edd6bda20
    IRP USBD_STATUS: USBD_STATUS_SUCCESS (0x00000000)
    URB Function: URB_FUNCTION_BULK_OR_INTERRUPT_TRANSFER (0x0009)
    IRP information: 0x01, Direction: PDO -> FDO
    URB bus id: 1
    Device address: 16
    Endpoint: 0x81, Direction: IN
    URB transfer type: URB_INTERRUPT (0x01)
    Packet Data Length: 8
    [Request in: 178]
    [Time from request: 2.063908000 seconds]
    [bInterfaceClass: HID (0x03)]
HID Data: 0000390000000000

No.     Time           Source                Destination           Protocol Length Info
    185 44.673741      1.16.1                host                  USB      35     URB_INTERRUPT in

Frame 185: 35 bytes on wire (280 bits), 35 bytes captured (280 bits) on interface wireshark_extcap2640, id 0
USB URB
    [Source: 1.16.1]
    [Destination: host]
    USBPcap pseudoheader length: 27
    IRP ID: 0xffff980ed6e4ea20
    IRP USBD_STATUS: USBD_STATUS_SUCCESS (0x00000000)
    URB Function: URB_FUNCTION_BULK_OR_INTERRUPT_TRANSFER (0x0009)
    IRP information: 0x01, Direction: PDO -> FDO
    URB bus id: 1
    Device address: 16
    Endpoint: 0x81, Direction: IN
    URB transfer type: URB_INTERRUPT (0x01)
    Packet Data Length: 8
    [Request in: 180]
    [Time from request: 2.175987000 seconds]
    [bInterfaceClass: HID (0x03)]
HID Data: 0000000000000000

No.     Time           Source                Destination           Protocol Length Info
    187 44.945736      1.16.1                host                  USB      35     URB_INTERRUPT in

Frame 187: 35 bytes on wire (280 bits), 35 bytes captured (280 bits) on interface wireshark_extcap2640, id 0
USB URB
    [Source: 1.16.1]
    [Destination: host]
    USBPcap pseudoheader length: 27
    IRP ID: 0xffff980edd6bda20
    IRP USBD_STATUS: USBD_STATUS_SUCCESS (0x00000000)
    URB Function: URB_FUNCTION_BULK_OR_INTERRUPT_TRANSFER (0x0009)
    IRP information: 0x01, Direction: PDO -> FDO
    URB bus id: 1
    Device address: 16
    Endpoint: 0x81, Direction: IN
    URB transfer type: URB_INTERRUPT (0x01)
    Packet Data Length: 8
    [Request in: 182]
    [Time from request: 0.455960000 seconds]
    [bInterfaceClass: HID (0x03)]
HID Data: 00000e0000000000

No.     Time           Source                Destination           Protocol Length Info
    189 45.153829      1.16.1                host                  USB      35     URB_INTERRUPT in

Frame 189: 35 bytes on wire (280 bits), 35 bytes captured (280 bits) on interface wireshark_extcap2640, id 0
USB URB
    [Source: 1.16.1]
    [Destination: host]
    USBPcap pseudoheader length: 27
    IRP ID: 0xffff980ed6e4ea20
    IRP USBD_STATUS: USBD_STATUS_SUCCESS (0x00000000)
    URB Function: URB_FUNCTION_BULK_OR_INTERRUPT_TRANSFER (0x0009)
    IRP information: 0x01, Direction: PDO -> FDO
    URB bus id: 1
    Device address: 16
    Endpoint: 0x81, Direction: IN
    URB transfer type: URB_INTERRUPT (0x01)
    Packet Data Length: 8
    [Request in: 186]
    [Time from request: 0.480043000 seconds]
    [bInterfaceClass: HID (0x03)]
HID Data: 0000000000000000

No.     Time           Source                Destination           Protocol Length Info
    191 46.481750      1.16.1                host                  USB      35     URB_INTERRUPT in

Frame 191: 35 bytes on wire (280 bits), 35 bytes captured (280 bits) on interface wireshark_extcap2640, id 0
USB URB
    [Source: 1.16.1]
    [Destination: host]
    USBPcap pseudoheader length: 27
    IRP ID: 0xffff980edd6bda20
    IRP USBD_STATUS: USBD_STATUS_SUCCESS (0x00000000)
    URB Function: URB_FUNCTION_BULK_OR_INTERRUPT_TRANSFER (0x0009)
    IRP information: 0x01, Direction: PDO -> FDO
    URB bus id: 1
    Device address: 16
    Endpoint: 0x81, Direction: IN
    URB transfer type: URB_INTERRUPT (0x01)
    Packet Data Length: 8
    [Request in: 188]
    [Time from request: 1.535972000 seconds]
    [bInterfaceClass: HID (0x03)]
HID Data: 0000200000000000

No.     Time           Source                Destination           Protocol Length Info
    193 46.721746      1.16.1                host                  USB      35     URB_INTERRUPT in

Frame 193: 35 bytes on wire (280 bits), 35 bytes captured (280 bits) on interface wireshark_extcap2640, id 0
USB URB
    [Source: 1.16.1]
    [Destination: host]
    USBPcap pseudoheader length: 27
    IRP ID: 0xffff980ed6e4ea20
    IRP USBD_STATUS: USBD_STATUS_SUCCESS (0x00000000)
    URB Function: URB_FUNCTION_BULK_OR_INTERRUPT_TRANSFER (0x0009)
    IRP information: 0x01, Direction: PDO -> FDO
    URB bus id: 1
    Device address: 16
    Endpoint: 0x81, Direction: IN
    URB transfer type: URB_INTERRUPT (0x01)
    Packet Data Length: 8
    [Request in: 190]
    [Time from request: 1.567877000 seconds]
    [bInterfaceClass: HID (0x03)]
HID Data: 0000000000000000

No.     Time           Source                Destination           Protocol Length Info
    195 48.281744      1.16.1                host                  USB      35     URB_INTERRUPT in

Frame 195: 35 bytes on wire (280 bits), 35 bytes captured (280 bits) on interface wireshark_extcap2640, id 0
USB URB
    [Source: 1.16.1]
    [Destination: host]
    USBPcap pseudoheader length: 27
    IRP ID: 0xffff980edd6bda20
    IRP USBD_STATUS: USBD_STATUS_SUCCESS (0x00000000)
    URB Function: URB_FUNCTION_BULK_OR_INTERRUPT_TRANSFER (0x0009)
    IRP information: 0x01, Direction: PDO -> FDO
    URB bus id: 1
    Device address: 16
    Endpoint: 0x81, Direction: IN
    URB transfer type: URB_INTERRUPT (0x01)
    Packet Data Length: 8
    [Request in: 192]
    [Time from request: 1.799911000 seconds]
    [bInterfaceClass: HID (0x03)]
HID Data: 00001c0000000000

No.     Time           Source                Destination           Protocol Length Info
    197 48.553743      1.16.1                host                  USB      35     URB_INTERRUPT in

Frame 197: 35 bytes on wire (280 bits), 35 bytes captured (280 bits) on interface wireshark_extcap2640, id 0
USB URB
    [Source: 1.16.1]
    [Destination: host]
    USBPcap pseudoheader length: 27
    IRP ID: 0xffff980ed6e4ea20
    IRP USBD_STATUS: USBD_STATUS_SUCCESS (0x00000000)
    URB Function: URB_FUNCTION_BULK_OR_INTERRUPT_TRANSFER (0x0009)
    IRP information: 0x01, Direction: PDO -> FDO
    URB bus id: 1
    Device address: 16
    Endpoint: 0x81, Direction: IN
    URB transfer type: URB_INTERRUPT (0x01)
    Packet Data Length: 8
    [Request in: 194]
    [Time from request: 1.831910000 seconds]
    [bInterfaceClass: HID (0x03)]
HID Data: 0000000000000000

No.     Time           Source                Destination           Protocol Length Info
    199 49.345782      1.16.1                host                  USB      35     URB_INTERRUPT in

Frame 199: 35 bytes on wire (280 bits), 35 bytes captured (280 bits) on interface wireshark_extcap2640, id 0
USB URB
    [Source: 1.16.1]
    [Destination: host]
    USBPcap pseudoheader length: 27
    IRP ID: 0xffff980edd6bda20
    IRP USBD_STATUS: USBD_STATUS_SUCCESS (0x00000000)
    URB Function: URB_FUNCTION_BULK_OR_INTERRUPT_TRANSFER (0x0009)
    IRP information: 0x01, Direction: PDO -> FDO
    URB bus id: 1
    Device address: 16
    Endpoint: 0x81, Direction: IN
    URB transfer type: URB_INTERRUPT (0x01)
    Packet Data Length: 8
    [Request in: 196]
    [Time from request: 1.063906000 seconds]
    [bInterfaceClass: HID (0x03)]
HID Data: 00001f0000000000

No.     Time           Source                Destination           Protocol Length Info
    201 49.617734      1.16.1                host                  USB      35     URB_INTERRUPT in

Frame 201: 35 bytes on wire (280 bits), 35 bytes captured (280 bits) on interface wireshark_extcap2640, id 0
USB URB
    [Source: 1.16.1]
    [Destination: host]
    USBPcap pseudoheader length: 27
    IRP ID: 0xffff980ed6e4ea20
    IRP USBD_STATUS: USBD_STATUS_SUCCESS (0x00000000)
    URB Function: URB_FUNCTION_BULK_OR_INTERRUPT_TRANSFER (0x0009)
    IRP information: 0x01, Direction: PDO -> FDO
    URB bus id: 1
    Device address: 16
    Endpoint: 0x81, Direction: IN
    URB transfer type: URB_INTERRUPT (0x01)
    Packet Data Length: 8
    [Request in: 198]
    [Time from request: 1.063910000 seconds]
    [bInterfaceClass: HID (0x03)]
HID Data: 0000000000000000

No.     Time           Source                Destination           Protocol Length Info
    203 50.745835      1.16.1                host                  USB      35     URB_INTERRUPT in

Frame 203: 35 bytes on wire (280 bits), 35 bytes captured (280 bits) on interface wireshark_extcap2640, id 0
USB URB
    [Source: 1.16.1]
    [Destination: host]
    USBPcap pseudoheader length: 27
    IRP ID: 0xffff980edd6bda20
    IRP USBD_STATUS: USBD_STATUS_SUCCESS (0x00000000)
    URB Function: URB_FUNCTION_BULK_OR_INTERRUPT_TRANSFER (0x0009)
    IRP information: 0x01, Direction: PDO -> FDO
    URB bus id: 1
    Device address: 16
    Endpoint: 0x81, Direction: IN
    URB transfer type: URB_INTERRUPT (0x01)
    Packet Data Length: 8
    [Request in: 200]
    [Time from request: 1.400008000 seconds]
    [bInterfaceClass: HID (0x03)]
HID Data: 0000390000000000

No.     Time           Source                Destination           Protocol Length Info
    207 50.905750      1.16.1                host                  USB      35     URB_INTERRUPT in

Frame 207: 35 bytes on wire (280 bits), 35 bytes captured (280 bits) on interface wireshark_extcap2640, id 0
USB URB
    [Source: 1.16.1]
    [Destination: host]
    USBPcap pseudoheader length: 27
    IRP ID: 0xffff980ed6e4ea20
    IRP USBD_STATUS: USBD_STATUS_SUCCESS (0x00000000)
    URB Function: URB_FUNCTION_BULK_OR_INTERRUPT_TRANSFER (0x0009)
    IRP information: 0x01, Direction: PDO -> FDO
    URB bus id: 1
    Device address: 16
    Endpoint: 0x81, Direction: IN
    URB transfer type: URB_INTERRUPT (0x01)
    Packet Data Length: 8
    [Request in: 202]
    [Time from request: 1.287923000 seconds]
    [bInterfaceClass: HID (0x03)]
HID Data: 0000000000000000

No.     Time           Source                Destination           Protocol Length Info
    209 51.105742      1.16.1                host                  USB      35     URB_INTERRUPT in

Frame 209: 35 bytes on wire (280 bits), 35 bytes captured (280 bits) on interface wireshark_extcap2640, id 0
USB URB
    [Source: 1.16.1]
    [Destination: host]
    USBPcap pseudoheader length: 27
    IRP ID: 0xffff980edd6bda20
    IRP USBD_STATUS: USBD_STATUS_SUCCESS (0x00000000)
    URB Function: URB_FUNCTION_BULK_OR_INTERRUPT_TRANSFER (0x0009)
    IRP information: 0x01, Direction: PDO -> FDO
    URB bus id: 1
    Device address: 16
    Endpoint: 0x81, Direction: IN
    URB transfer type: URB_INTERRUPT (0x01)
    Packet Data Length: 8
    [Request in: 204]
    [Time from request: 0.359803000 seconds]
    [bInterfaceClass: HID (0x03)]
HID Data: 2000000000000000

No.     Time           Source                Destination           Protocol Length Info
    211 51.433727      1.16.1                host                  USB      35     URB_INTERRUPT in

Frame 211: 35 bytes on wire (280 bits), 35 bytes captured (280 bits) on interface wireshark_extcap2640, id 0
USB URB
    [Source: 1.16.1]
    [Destination: host]
    USBPcap pseudoheader length: 27
    IRP ID: 0xffff980ed6e4ea20
    IRP USBD_STATUS: USBD_STATUS_SUCCESS (0x00000000)
    URB Function: URB_FUNCTION_BULK_OR_INTERRUPT_TRANSFER (0x0009)
    IRP information: 0x01, Direction: PDO -> FDO
    URB bus id: 1
    Device address: 16
    Endpoint: 0x81, Direction: IN
    URB transfer type: URB_INTERRUPT (0x01)
    Packet Data Length: 8
    [Request in: 208]
    [Time from request: 0.527876000 seconds]
    [bInterfaceClass: HID (0x03)]
HID Data: 2000300000000000

No.     Time           Source                Destination           Protocol Length Info
    213 51.665747      1.16.1                host                  USB      35     URB_INTERRUPT in

Frame 213: 35 bytes on wire (280 bits), 35 bytes captured (280 bits) on interface wireshark_extcap2640, id 0
USB URB
    [Source: 1.16.1]
    [Destination: host]
    USBPcap pseudoheader length: 27
    IRP ID: 0xffff980edd6bda20
    IRP USBD_STATUS: USBD_STATUS_SUCCESS (0x00000000)
    URB Function: URB_FUNCTION_BULK_OR_INTERRUPT_TRANSFER (0x0009)
    IRP information: 0x01, Direction: PDO -> FDO
    URB bus id: 1
    Device address: 16
    Endpoint: 0x81, Direction: IN
    URB transfer type: URB_INTERRUPT (0x01)
    Packet Data Length: 8
    [Request in: 210]
    [Time from request: 0.559912000 seconds]
    [bInterfaceClass: HID (0x03)]
HID Data: 2000000000000000

No.     Time           Source                Destination           Protocol Length Info
    215 51.785727      1.16.1                host                  USB      35     URB_INTERRUPT in

Frame 215: 35 bytes on wire (280 bits), 35 bytes captured (280 bits) on interface wireshark_extcap2640, id 0
USB URB
    [Source: 1.16.1]
    [Destination: host]
    USBPcap pseudoheader length: 27
    IRP ID: 0xffff980ed6e4ea20
    IRP USBD_STATUS: USBD_STATUS_SUCCESS (0x00000000)
    URB Function: URB_FUNCTION_BULK_OR_INTERRUPT_TRANSFER (0x0009)
    IRP information: 0x01, Direction: PDO -> FDO
    URB bus id: 1
    Device address: 16
    Endpoint: 0x81, Direction: IN
    URB transfer type: URB_INTERRUPT (0x01)
    Packet Data Length: 8
    [Request in: 212]
    [Time from request: 0.351958000 seconds]
    [bInterfaceClass: HID (0x03)]
HID Data: 0000000000000000
